{
  "schemaVersion": 1,
  "seed": 7,
  "inputTrack": "arena-v1",
  "buildHash": "a33daf8",
  "evidence_status": "measured_on_reference_device",
  "device": {
    "userAgent": "Mozilla/5.0 (Macintosh; Intel Mac OS X 10_15_7) AppleWebKit/537.36 (KHTML, like Gecko) Chrome/152.0.0.0 Safari/537.36",
    "dpr": 1.7999999523162842,
    "hardwareConcurrency": 10,
    "viewport": [
      1856,
      1070
    ],
    "adapter": {
      "vendor": "apple",
      "architecture": "metal-3",
      "device": "",
      "description": ""
    },
    "platform": "MacIntel"
  },
  "browser": "Chrome",
  "backend": "webgpu",
  "timestamp": "2026-09-03T03:46:28.545Z",
  "config": {
    "runs": 1,
    "seconds": 10,
    "warmup": 2,
    "quality": "high",
    "rain": 20000,
    "shadow": 2048,
    "dynamicResolution": true
  },
  "runs": [
    {
      "frames": 953,
      "duration_s": 10.0001,
      "fps_avg": 95.2990470095299,
      "fps_1pct_low": 56.99809951252566,
      "frame_p95": 17,
      "frame_p99": 17.5,
      "cpu_sim_p95": 0.29999998211860657,
      "cpu_render_p95": 4.199999809265137,
      "draw_calls_avg": 319.9916054564533,
      "triangles_avg": 2030338.5330535152,
      "heap_start_mb": 70.8934555053711,
      "heap_end_mb": 70.8934555053711,
      "heap_delta_mb": 0,
      "scale_avg": 1,
      "render_width_avg": 1920,
      "actors_full_avg": 0,
      "actors_total_avg": 9,
      "gpu_ms_p95": 31.129600524902344,
      "gpu_method": "timestamp_query",
      "shader_hitches": 0
    }
  ],
  "median": {
    "frames": 953,
    "duration_s": 10.0001,
    "fps_avg": 95.2990470095299,
    "fps_1pct_low": 56.99809951252566,
    "frame_p95": 17,
    "frame_p99": 17.5,
    "cpu_sim_p95": 0.29999998211860657,
    "cpu_render_p95": 4.199999809265137,
    "draw_calls_avg": 319.9916054564533,
    "triangles_avg": 2030338.5330535152,
    "heap_start_mb": 70.8934555053711,
    "heap_end_mb": 70.8934555053711,
    "heap_delta_mb": 0,
    "scale_avg": 1,
    "render_width_avg": 1920,
    "actors_full_avg": 0,
    "actors_total_avg": 9,
    "gpu_ms_p95": 31.129600524902344,
    "gpu_method": "timestamp_query",
    "shader_hitches": 0
  },
  "budgetCheck": {
    "fps_avg": {
      "value": 95.299,
      "target": 60,
      "red": null,
      "status": "PASS"
    },
    "fps_1pct_low": {
      "value": 56.998,
      "target": 45,
      "red": 40,
      "status": "PASS"
    },
    "frame_p95": {
      "value": 17,
      "target": 18.5,
      "red": 22,
      "status": "PASS"
    },
    "render_resolution": {
      "value": 1920,
      "target": 1920,
      "red": 2560,
      "status": "PASS"
    },
    "gpu_ms": {
      "value": 31.13,
      "target": 10.5,
      "red": 14,
      "status": "FAIL"
    },
    "cpu_sim_ms": {
      "value": 0.3,
      "target": 5,
      "red": 8,
      "status": "PASS"
    },
    "draw_calls": {
      "value": 319.992,
      "target": 400,
      "red": 650,
      "status": "PASS"
    },
    "triangles": {
      "value": 2030338.533,
      "target": 2500000,
      "red": 4000000,
      "status": "PASS"
    },
    "skinned_actors": {
      "value": 9,
      "target": 10,
      "red": 14,
      "status": "PASS"
    },
    "ai_full": {
      "value": 0,
      "target": 8,
      "red": 16,
      "status": "PASS"
    },
    "gpu_memory_gb": {
      "value": null,
      "target": 3.5,
      "red": 5,
      "status": "NA"
    },
    "js_heap_mb": {
      "value": 70.893,
      "target": 700,
      "red": 1000,
      "status": "PASS"
    },
    "initial_payload_mb": {
      "value": null,
      "target": 150,
      "red": 250,
      "status": "NA"
    },
    "level_total_mb": {
      "value": null,
      "target": 750,
      "red": 1200,
      "status": "NA"
    },
    "audio_voices": {
      "value": null,
      "target": 32,
      "red": 48,
      "status": "NA"
    }
  },
  "verdict": "FAIL",
  "notes": [
    "WebGPU backend: draw_calls counts BatchedMesh sub-draws (1 drawIndexed per instance, same pipeline)."
  ]
}