{
  "schemaVersion": 1,
  "seed": 7,
  "inputTrack": "arena-v1",
  "buildHash": "8c65174",
  "evidence_status": "measured_on_reference_device",
  "device": {
    "userAgent": "Mozilla/5.0 (Macintosh; Intel Mac OS X 10_15_7) AppleWebKit/537.36 (KHTML, like Gecko) Chrome/152.0.0.0 Safari/537.36",
    "dpr": 1.7999999523162842,
    "hardwareConcurrency": 10,
    "viewport": [
      1856,
      1070
    ],
    "adapter": {
      "vendor": "apple",
      "architecture": "metal-3",
      "device": "",
      "description": ""
    },
    "platform": "MacIntel"
  },
  "browser": "Chrome",
  "backend": "webgpu",
  "timestamp": "2026-09-03T04:15:13.517Z",
  "config": {
    "runs": 1,
    "seconds": 10,
    "warmup": 2,
    "quality": "high",
    "rain": 9000,
    "shadow": 2048,
    "dynamicResolution": true
  },
  "runs": [
    {
      "frames": 892,
      "duration_s": 10.055,
      "fps_avg": 88.7120835405271,
      "fps_1pct_low": 43.78762981167318,
      "frame_p95": 17.100000381469727,
      "frame_p99": 17.5,
      "cpu_sim_p95": 0.30000001192092896,
      "cpu_render_p95": 8.199999809265137,
      "draw_calls_avg": 320.8688340807175,
      "triangles_avg": 1993897.4327354261,
      "heap_start_mb": 36.52649688720703,
      "heap_end_mb": 36.52649688720703,
      "heap_delta_mb": 0,
      "scale_avg": 1,
      "render_width_avg": 1920,
      "actors_full_avg": 0,
      "actors_total_avg": 9,
      "gpu_ms_p95": null,
      "gpu_method": "unavailable",
      "gpu_overlap_frames": 891,
      "shader_hitches": 0
    }
  ],
  "median": {
    "frames": 892,
    "duration_s": 10.055,
    "fps_avg": 88.7120835405271,
    "fps_1pct_low": 43.78762981167318,
    "frame_p95": 17.100000381469727,
    "frame_p99": 17.5,
    "cpu_sim_p95": 0.30000001192092896,
    "cpu_render_p95": 8.199999809265137,
    "draw_calls_avg": 320.8688340807175,
    "triangles_avg": 1993897.4327354261,
    "heap_start_mb": 36.52649688720703,
    "heap_end_mb": 36.52649688720703,
    "heap_delta_mb": 0,
    "scale_avg": 1,
    "render_width_avg": 1920,
    "actors_full_avg": 0,
    "actors_total_avg": 9,
    "gpu_ms_p95": null,
    "gpu_method": "unavailable",
    "gpu_overlap_frames": 891,
    "shader_hitches": 0
  },
  "budgetCheck": {
    "fps_avg": {
      "value": 88.712,
      "target": 60,
      "red": null,
      "status": "PASS"
    },
    "fps_1pct_low": {
      "value": 43.788,
      "target": 45,
      "red": 40,
      "status": "WARN"
    },
    "frame_p95": {
      "value": 17.1,
      "target": 18.5,
      "red": 22,
      "status": "PASS"
    },
    "render_resolution": {
      "value": 1920,
      "target": 1920,
      "red": 2560,
      "status": "PASS"
    },
    "gpu_ms": {
      "value": null,
      "target": 10.5,
      "red": 14,
      "status": "NA"
    },
    "cpu_sim_ms": {
      "value": 0.3,
      "target": 5,
      "red": 8,
      "status": "PASS"
    },
    "draw_calls": {
      "value": 320.869,
      "target": 400,
      "red": 650,
      "status": "PASS"
    },
    "triangles": {
      "value": 1993897.433,
      "target": 2500000,
      "red": 4000000,
      "status": "PASS"
    },
    "skinned_actors": {
      "value": 9,
      "target": 10,
      "red": 14,
      "status": "PASS"
    },
    "ai_full": {
      "value": 0,
      "target": 8,
      "red": 16,
      "status": "PASS"
    },
    "gpu_memory_gb": {
      "value": null,
      "target": 3.5,
      "red": 5,
      "status": "NA"
    },
    "js_heap_mb": {
      "value": 36.526,
      "target": 700,
      "red": 1000,
      "status": "PASS"
    },
    "initial_payload_mb": {
      "value": null,
      "target": 150,
      "red": 250,
      "status": "NA"
    },
    "level_total_mb": {
      "value": null,
      "target": 750,
      "red": 1200,
      "status": "NA"
    },
    "audio_voices": {
      "value": null,
      "target": 32,
      "red": 48,
      "status": "NA"
    }
  },
  "verdict": "WARN",
  "notes": [
    "GPU timestamp query unavailable: gpu_ms = NA, use the browser profiler.",
    "GPU timestamp: 891 frames dropped where the per-pass sum exceeded frame time (overlapping passes on TBDR GPUs) — gpu_ms_p95 is from the remaining frames; frame_p95 bounds the true GPU cost.",
    "WebGPU backend: draw_calls counts BatchedMesh sub-draws (1 drawIndexed per instance, same pipeline)."
  ]
}